Outdated_content,Updated_content,Temporal_validity_Tag
ating global coral bleaching event could hit great barrier reef next nevada’s solar workers and customers reel as new rules ‘shut down’ industry green investment bank ‘no longer required by law to invest in green projects’ indoor and outdoor air pollution ‘claiming at least 40000 uk lives a year’,ating global coral bleaching event could hit great barrier reef next nevada’s solar workers and customers reel as new rules ‘shut down’ industry green investment bank ‘no longer required by law to invest in green projects’ the australian government has abandoned plans to spend $10,0
77 dead caused 200bn in damage and left thousands homeless and the rebuilding will be the largest effort since new orleans following hurricane katrina and the clearup is proving equally dangerous a new report produced by the university of illinois chicago in conjunction with workers’ rights groups paints a startling picture of the inequ,77 dead caused 200bn in damage and left thousands homeless and the rebuilding will be the largest effort since new orleans following hurricane katrina and the clearup is proving equally dangerous a new report produced by the uk’s national risk assessment centre (nrac) has found that the,1
beat each other in a series of wacky tasks that put their singing abilities and overall star quality to the test hrant and dec’s limitless win830pm itvthe twosome’s game show with a never ending money ladder is back this week jimmy carr and katherine ryan complete the game they started on the,"beat each other in a series of wacky tasks that put their singing abilities and overall star quality to the test hrant and dec’s limitless win830pm itvthe twosome’s game show with a never-ending supply of tasks that are wacky, funny and often surprising. it’",1
styles and manners when the dancers hit the inlaid circle of marble on the floor under the duveen cupola some quiet folderol music delays them for a couple of minutes before they continue on their way stealthy in their ballet pumps we are not meant to join in no disco dads allowed though i suppose there are some who,"styles and manners when the dancers hit the inlaid circle of marble on the floor under the duveen cupola some quiet folderol music delays them for a couple of minutes before they continue on their way stealthy as a cat, they make their way into the room. it is a very quiet room, and the moment",0
pablo bronstein review – no disco dads allowed in tates timebender pablo bronstein has turned tate britain’s duveen galleries into a stage a promenade a piazza three dancers move stop and move again through the length of the long hall they dance and pose flutter their hands come together and part echoing one another,"pablo bronstein review – no disco dads allowed in tates timebender pablo bronstein has turned tate britain’s duveen galleries into a stage a promenade a piazza three dancers move stop-go on the floor, their arms and legs extended like the branches of a tree. a violinist, a",1
ed across farms community fields and road verges creating wildflower corridors that are in effect a “road system” for bees helping them to easily move across the landscapenick heasman who leads bee lines for the national park said “bees are vital ecosystem engineers and it’s so important we try to halt and,"ed across farms community fields and road verges creating wildflower corridors that are in effect a “road system” for bees helping them to easily move across the landscapenick heasman who leads bee lines for the farming charity bees for development, has created a wildflower corrid",0
a little easier when standing in the winner’s enclosure after one of the season’s most valuable events “panicked” “stupid” and “a mess” were three of the ways john gosden described the first half of too darn hot’s season here on wednesday but that is now a distant memory thanks to a halfl,a little easier when standing in the winner’s enclosure after one of the season’s most valuable events “panicked” “stupid” and “a mess” were three of the ways john gosden described the first half of the 2022 spring meeting at the galop. the racecourse had been,1
held until august 2016 – two months after his supposed arrest he was released after an associate presented authorities with another fake passport and he was repatriated to his supposed country of origin the article says “his time in prison explains why the italian wiretaps on his sudanese number picked up nothing in the months before berhe was arrested it also,"held until august 2016 – two months after his supposed arrest he was released after an associate presented authorities with another fake passport and he was repatriated to his supposed country of origin the article says “his time in prison explains why he was able to pass himself off as a foreigner”, but it doesn’t say how",0
morenew zealand’s fisheries management assessed populations in one of its orange roughy fisheries and found that the age of breeding was “unexpectedly high” with only 50 of stocks spawning by 55 years oldthe age at which 95 of stocks were breeding was 733 yearsthe,morenew zealand’s fisheries management assessed populations in one of its orange roughy fisheries and found that the age of breeding was “unexpectedly high” with only 50 of stocks spawning by 13 years old. the study by researchers at the country’,0
fourth quarter of this year the drugmaker said on wednesdaythe move comes amid criticism of healthcare companies by us lawmakers over rising costs of insulin with joe biden’s signature inflation reduction act including a 3 5 cap on insulin for those enrolled in medicare health insurance plansmore than a million americans ration,fourth quarter of this year the drugmaker said on wednesdaythe move comes amid criticism of healthcare companies by us lawmakers over rising costs of insulin with joe biden’s signature inflation reduction act including a 30% cap on insulin prices. the move follows a similar decision by the,0
as the ball cannoned off him as he charged down a liam moore clearance in the 81st minute and there were 11 draws between preston and nottingham forest and qpr and bristol city who beat manchester united in midweek in saturday’s late game sheffield united recovered from conceding two,"as the ball cannoned off him as he charged down a liam moore clearance in the 81st minute and there were 11 draws between preston and nottingham forest and qpr and bristol city who are level on points, the question on every football fan’s lips is",0
teen assistant in south wales was politely asked not to address judges merely as “love” as she had always done letters 30 july she was told that “your honour” would be appropriate the next day she duly proc laimed “good morning your honour love” his hon merfyn hughes qc beaumaris anglesey • al,"teen assistant in south wales was politely asked not to address judges merely as “love” as she had always done letters 30 july she was told that “your honour” would be appropriate the next day she duly apologised, but that was not the end of it. the teen",0
icit hyperactivity disorder adhd – have campaigned for accommodations that would allow us to do our jobs well chief among these is the flexibility to work from home for many of us the remote work era facilitated by covid19 has changed our lives for the better despite the grief and anxiety of the pandemic now as the world begins to re,icit hyperactivity disorder adhd – have campaigned for accommodations that would allow us to do our jobs well chief among these is the flexibility to work from home for many of us the remote work era facilitated by covid19 has been a godsend for many people with attention deficit hyperactivity disorder (adhd). for,0
bank of england is not going to intervene in the currency markets to buy pounds when ministerial rhetoric is pushing the exchange rate lower higher interest rates are not an option either because the economy is weak there are two big risks for the government the first is that an intensification of the selling pressure on the pound means that johnson bl,"bank of england is not going to intervene in the currency markets to buy pounds when ministerial rhetoric is pushing the exchange rate lower higher interest rates are not an option either because the economy is weak there are two big risks to the pound. first, if the government were to push the exchange rate down by saying it",0
ouble” harris the lads from the anfield wrap and big paper’s own floating football brain in a jar jonathan wilson tweeted their own experiences and those of the liverpool fans left feeling let down unsafe and downright scared still there were plenty more on social media – but crucially nowhere near paris – who knew better,ouble” harris the lads from the anfield wrap and big paper’s own floating football brain in a jar jonathan wilson tweeted their own experiences and those of the liverpool fans left feeling let down unsafe on the terrace. “i’m not sure if i’ve ever seen a post like,0
the scale of the commitment needed stuart goodall confor’s chief executive said“with england what’s been very frustrating for me is that the government is not throwing the kitchen sink at this it’s not lear nt lessons from elsewhere where there has been progress in planting such as in scotland and is trying to deliver types,the scale of the commitment needed stuart goodall confor’s chief executive said“with england what’s been very frustrating for me is that the government is not throwing the kitchen sink at this it’s not learnt from the past. it’s not putting in the resources to really get the job done.” st,0
cardi b says she will launch haircare line to teach people about ‘afrolatina’ hair cardi b has said she will launch her own range of haircare products in an attempt to teach people about “afrolatina ” hair the rapper said she was inspired to work on the products after receiving offensive comments about a video she posted about,"cardi b says she will launch haircare line to teach people about ‘afrolatina’ hair cardi b has said she will launch her own range of haircare products in an attempt to teach people about “afrolatina” hair. the singer, who is of jamaican and latina heritage, said she was inspired to",1
current income tax treatment of the discretionary trust is grossly inequitable compared with other entities and other taxpayers it causes large losses of tax revenue and significantly undermines the integrity of our income tax system it is widely seen as a joke there are around 650000 discretionary trusts and their number is rising,current income tax treatment of the discretionary trust is grossly inequitable compared with other entities and other taxpayers it causes large losses of tax revenue and significantly undermines the integrity of our income tax system it is widely seen as the worst of all taxes and its unfairness has been,1
latest water audit finds more than 100 nsw properties extracting too much the new south wales water regulator has identified more than 100 cases where farms have taken more water than they are entitled to including 1 3 that merited serious enforcement actionthe first comprehensive audit of overdrawn accounts by the natural resources access reg,latest water audit finds more than 100 nsw properties extracting too much the new south wales water regulator has identified more than 100 cases where farms have taken more water than they are entitled to including 11 properties extracting more than 10 times the amount they should have been allowed to,1
equipment and covid testing during the pandemic speaking on wednesday at a royal society conference on the science of covid sir john bell regius professor of medicine at oxford university and the government’s life sciences adviser said the behaviour of certain companies in the middle of the crisis was “extremely unacceptable” the government has come under heavy criticism,equipment and covid testing during the pandemic speaking on wednesday at a royal society conference on the science of covid sir john bell regius professor of medicine at oxford university and the government’s life sciences adviser said the behavioural and social sciences were “under-used” in the pandemic. he added that the,1
want one exclusively for yourself that longstanding tradition is now giving way to its modern substitute snapp iran’s version of uber which is also offering something unique – a fleet of female drivers for women and children for years international sanctions have kept global companies out of iran which has in turn spurred a tech startup boom as local experts build,"want one exclusively for yourself that longstanding tradition is now giving way to its modern substitute snapp iran’s version of uber which is also offering something unique – a fleet of female drivers for women and children for years international sanctions have kept iran out of the global car-sharing market, so it is no surprise that",1
the observer view on india’s divisive citizenship law  observer editori narendra modi’s new indian citizenship law is dangerous and offensive it is dangerous because it institutionalises and encourages discrimination against mus lims a minority of 200 million people that is already the target of daily petty prejudice and,the observer view on india’s divisive citizenship law  observer editori narendra modi’s new indian citizenship law is dangerous and offensive it is dangerous because it institutionalises and encourages discrimination against muslims and other minorities. it is offensive because it undermines the,0
laimed “good morning your honour love” his hon merfyn hughes qc beaumaris anglesey • alastair campbell opinion 30 july says we need “an alternative who can stand up to johnson and lead the country against the disaster which is in the making” save us from disasters in the making remember ira,"laimed “good morning your honour love” his hon merfyn hughes qc beaumaris anglesey • alastair campbell opinion 30 july says we need “an alternative who can stand up to johnson” the new leader of the labour party, alastair campbell, has been a long",1
wildlife that have had to find alternative places of solace include raccoons foxes song birds coyotes skunks and rabbits but the colorado parks and wildlife government agency filed 21 criminal charges and refused to renew seifert’s animal rehabilitation license accusing him of keeping rescued animals for too long and,"wildlife that have had to find alternative places of solace include raccoons foxes song birds coyotes skunks and rabbits but the colorado parks and wildlife government agency filed 21 criminal charges and refused to comment on the case, citing a state law that prevents it from discuss",0
bank of england warns high inflation could last longer than expected the bank of england’s chief economist has warned high rates of uk inflation could persist for longer than expected despite a fall in wholesale energy prices in recent weeks and the economy on the brink of recessionhuw pill said the slowdown in the british economy and,bank of england warns high inflation could last longer than expected the bank of england’s chief economist has warned high rates of uk inflation could persist for longer than expected despite a fall in wholesale energy prices in recent months. david dunn said the “biggest risk” to the bank’s,1
heatthis article is more than 5 months old the punishing heatwaves that have scorched much of the us could result in a record number of heatrelated deaths this year experts have warned amid a spike in hospitalizations from collapsing workersamong those needing hospital treatment are heatexhausted hikers and even people who,heatthis article is more than 5 months old the punishing heatwaves that have scorched much of the us could result in a record number of heatrelated deaths this year experts have warned amid a spike in hospitalizations for heatstroke.the record-breaking heat has been blamed,1
they say and yet i don’t believe politicians will step uptop uk energy firms to warn rishi sunak ‘don’t back off green agenda’ read morethere is a route out of this trap politicians need to put forward bold policies for the climate that link to people’s aspirations and provide tangible benefits such as local jobs,"they say and yet i don’t believe politicians will step uptop uk energy firms to warn rishi sunak ‘don’t back off green agenda’ read morethere is a route out of this trap politicians need to take. the uk has a chance to get off fossil fuels and go green, but the",1
right now – we are in a time where it is dangerous to speak your mind” sign up to receive an email with the top stories from guardian australia every morning asked during the interview what she would say to trans children who may have been hurt by her comments deves said “this is about women’,"right now – we are in a time where it is dangerous to speak your mind” sign up to receive an email with the top stories from guardian australia every morning asked during the interview what she would say to trans children who may have been hurt by the bill, and why she feels so",1
ia gets taste for european cheeses brooding beauty why carmarthenshire is wales’ bestkept secret a step away from the lakes walking the ‘camino’ of cumbria 2021112 6,ia gets taste for european cheeses brooding beauty why carmarthenshire is wales’ bestkept secret a step away from the lakes walking the ‘camino’ of cumbria 2021110,0
country diary we wind slowly upwards with our precious cargo of willow at 650 metres there’s a cool haze and the mountains above and the valley below are bathed in a soft light i’m part of a 60strong work party heading over the cairngorm plateau to loch a’an carrying between us,country diary we wind slowly upwards with our precious cargo of willow at 650 metres there’s a cool haze and the mountains above and the valley below are bathed in a soft light i’m part of a small team of people who are responsible for a 30-year,1
without quotation marks weekly beast can revealpeter gleeson’s couriermail column the words in red are taken directly from the factsheet“the queensland parliament is unique among australian state parliaments as it is unicameral that is it only has one chamber” he wrote without attribution“unicameral legislatures are un,without quotation marks weekly beast can revealpeter gleeson’s couriermail column the words in red are taken directly from the factsheet“the queensland parliament is unique among australian state parliaments as it is the only one where the governor has the power to dissolve the parliament.”,1
city’s beaches and others along the orange county coast fishing in the affected area resumed only recently after testing confirmed fish did not have unsafe levels of oil toxins it also seeped into delicate wetlands that are critical habit ats for migratory and shorebirds and other end,"city’s beaches and others along the orange county coast fishing in the affected area resumed only recently after testing confirmed fish did not have unsafe levels of oil toxins it also seeped into delicate wetlands that are critical habitats for birds, scientists say.",1
wish” he was quoted as saying “senegal has been selected by its peers to lead the operations but we do not wish to start a conflict if he loves his people he has to be able to negotiate an exit door calmly if it doesn’t happen the most radical means will be used” barrow said in a statement that he “does not,wish” he was quoted as saying “senegal has been selected by its peers to lead the operations but we do not wish to start a conflict if he loves his people he has to be able to negotiate an exit door calmly and peacefully.” he added “senegal has a great responsibility to lead the way out of,1
came only hours after a commons debate on the british role in the saudi bombardment of yemen campaigners for the committee’s reinstatement claimed that though it had been chaired by a conservative sir john stan ley it had proved a source of embarrassment for the government the foreign office minister tobias ellwood responding for,"came only hours after a commons debate on the british role in the saudi bombardment of yemen campaigners for the committee’s reinstatement claimed that though it had been chaired by a conservative sir john stanier, it had been a cross-party affair, with members of the labour and liberal dem",1
idea of cheaper money the asxsp200 benchmark of leading shares was up 085 to 5264 points at 1230pm before falling back to 5232 by 230 pm the inflation rate of 13 is well below the rba’s target range of 23 which increases,"idea of cheaper money the asxsp200 benchmark of leading shares was up 085 to 5264 points at 1230pm before falling back to 5232 by 230pm.the benchmark had a good start to the week, with the big four banks",1
had just got big deals it’s really dangerous to be envious of other people’s success but i started to worry that maybe my shelf life was running out” she says “i’d written like 20 books and never broken through” she went for a beer with an editor at harpercollins who told her she wasn’t being,"had just got big deals it’s really dangerous to be envious of other people’s success but i started to worry that maybe my shelf life was running out” she says “i’d written like 20 books and never made any money out of it. so i thought, why not? i’ve got",1
struggling with their bills and communities around the world reeling from the climate crisis … instead of being stuffed in the pockets of shareholders and company bosses all this extra cash should be redirected towards public goods whether it’ s insulating uk homes or supporting communities suffering the consequences of,struggling with their bills and communities around the world reeling from the climate crisis … instead of being stuffed in the pockets of shareholders and company bosses all this extra cash should be redirected towards public goods whether it’s a new rail line or a new wind farm or,1
cats’ dirty little secret it’s a horny feline romp  catherine shoard the first clue was the silence neither whoops of entertainment nor hoots of derision met the first press screening of tom hooper’ s riotously anticipated cats yet more ominously there was no munching the free popcorn went,"cats’ dirty little secret it’s a horny feline romp  catherine shoard the first clue was the silence neither whoops of entertainment nor hoots of derision met the first press screening of tom hooper’s cats. the film is a triumph of visuals, but it",0
sex residents raised £75000 to help a young charity bee lines plant wildflower oases across the south downs national park helped out with grants from south downs national park trustthese oases have been plant ed across farms community fields and road verges creating wildflower corridors that are in effect a “road system,sex residents raised £75000 to help a young charity bee lines plant wildflower oases across the south downs national park helped out with grants from south downs national park trustthese oases have been planted to help the wild bee population. the south downs national park trust (sd,1
million sheep new zealand has roughly six sheep for every person and now the wooly beasts are helping drive a new movement farmtofoot typically most of our footwear is made from either natural materials such as leather or canvas or synth etic petroleumbased materials such as rubber plastic or cloth few manufacturers opt for wool though yet unlike,"million sheep new zealand has roughly six sheep for every person and now the wooly beasts are helping drive a new movement farmtofoot typically most of our footwear is made from either natural materials such as leather or canvas or synthetic materials such as nylon, polyester or rubber. but a new",1
ena earlier she had shared her emojistrewn experience of her behindthescenes meetandgreet package with her tens of thousands of likeminded followers beginning the day by tweeting “i meet ariana today” by the end of the day she was reposting an expression of grief from her idol over the course of the evening a,"ena earlier she had shared her emojistrewn experience of her behindthescenes meetandgreet package with her tens of thousands of likeminded followers beginning the day by tweeting “i meet ariana today” by 11pm, the night before she was due to arrive in london, she was already",0
lawyer for maurice blackburn in melbourne said achieving a settlement would make any subsequent claims by christmas island detainees “much easier” ballantyne told journalists outside court that the girl and her family were satisfied with the outcome “look there’s never any amount of compensation that can properly recognise what the lead plaintiff,"lawyer for maurice blackburn in melbourne said achieving a settlement would make any subsequent claims by christmas island detainees “much easier” ballantyne told journalists outside court that the girl and her family were satisfied with the agreement. “we’re very pleased with the outcome, and i think it",1
