Outdated_content,Updated_content,Temporal_validity_Tag
Ating role and transferred it to olly robbins at the cabinet office’s europe unit the timing misfired it hit the decks just as the two of them were up before the brexit committee sitting awkwardly together here are a few they hoped to skip past mps just after loud raf centenary celebrations bbc programmes with hero,"Ating role and transferred it to olly robbins at the cabinet office’s europe unit the timing misfired it hit the decks just as the two of them were up before the brexit committee sitting awkwardly together here. this was an important moment, because the prime minister was about to appear before the committee",1
reading out the mildly crazy things on his autocue in order to say something totally crazy off the top of his head he did it again at a rally in alabama on friday seemingly triggered by the words “res pect” and “flag” in his prepared remarks trump embarked on that dogwhistle rant about black,reading out the mildly crazy things on his autocue in order to say something totally crazy off the top of his head he did it again at a rally in alabama on friday seemingly triggered by the words “rescind the executive order” – the president’s attempt to reverse.,1
the excellent reporting of vic marks please keep selecting him julian page newton poppleford devon • after reading the guardian every day for the last six months i am now in the middle of a brexistential crisis geoff will iams wolverhampton • join the debate – email guardianletterstheguardiancom • read more guardian letters,"the excellent reporting of vic marks please keep selecting him julian page newton poppleford devon • after reading the guardian every day for the last six months i am now in the middle of a brexistential crisis geoff williams, who died in 2017, had a wonderful",1
tank for anyone still awake at the end none of my lot made the final credits there’s the option to sleep in front of the atlantic ocean exhibit incredibly nothing but the sharks stirred until 7am the following day exit through the gift shop opens early for those who want to snap up a cuddly lemon shark before,"tank for anyone still awake at the end none of my lot made the final credits there’s the option to sleep in front of the atlantic ocean exhibit incredibly nothing but the sharks stirred until 7am the following morning, by which time we’d all been woken by the roar of a helic",1
has been quoted in the bulgarian press as saying she has no plans to quit so both bulgarian candidates may run in the next security council ballot on 5 october it is unclear what impact georgieva’s late entrance will have on a contest that is already volatile and unpredictable antónio guterres a former portuguese prime,"has been quoted in the bulgarian press as saying she has no plans to quit so both bulgarian candidates may run in the next security council ballot on 5 october it is unclear what impact georgieva’s late entrance into the race will have on the bulgaria campaign, but her presence has been",0
higher government debt the obr’s recent fiscal risks report provides reeves with some political cover for her approach the spending watchdog said financing the netzero transition would add 21 of gross domestic product to the national debt but delaying action could double the cost reeves seemed to strike the right note with business groups who also,"higher government debt the obr’s recent fiscal risks report provides reeves with some political cover for her approach the spending watchdog said financing the netzero transition would add 21 of gross domestic product to the deficit by 2026-27, a higher estimate than the obr’",1
the directors denied any suggestion of wrongdoing or conflict of interest and said they made the appropriate declarationsnow guardian australia can reveal that one of those directors – house – holds interests in two other properties that sold a further 6 68m in offsets for developments in western sydney from 2017 to 2019,the directors denied any suggestion of wrongdoing or conflict of interest and said they made the appropriate declaration snow guardian australia can reveal that one of those directors – house – holds interests in two other properties that sold a further 650 hectares of land in the area.the direct,1
 migrants and refugees could soon be stranded in greece the government has said as it considers enlisting the help of the army to deal with the emergency the alarm was sounded as the eu’s top immigration policymaker said the situation was at risk of becoming uncontrollable unless member states “assume their," migrants and refugees could soon be stranded in greece the government has said as it considers enlisting the help of the army to deal with the emergency the alarm was sounded as the eu’s commissioner for migration and home affairs, david murphy, warned that.",1
on the nhs england board to use thursday’s meeting to reaffirm their commitment to people with mental health problems helen whately mp conservative chair of the allparty parliamentary group on mental health norman lamb mp liberal democrat chair of the science and technology committee and former minister with responsibility for mental health luciana berger mp,"on the nhs england board to use thursday’s meeting to reaffirm their commitment to people with mental health problems helen whately mp conservative chair of the allparty parliamentary group on mental health norman lamb said the nhs england board meeting on thursday would be an opportunity for the health secretary,",1
recall it which is probably tinged with fantasy i consulted pamela gawlerwright a ukcpaccredited contemporary psychotherapist psychotherapyorguk who had some valuable insights she thought it was great that “ at a relatively young age you have already found that relationships matter deeply to you and that emotions even the uncomfortable,recall it which is probably tinged with fantasy i consulted pamelagawlerw right a uk cp accredited contemporary psychotherapist psychotherapy.org.uk who had some valuable insights she thought it was great that “you are remembering it as it happened”. “it is a very positive thing to remember what happened in,0
routes that we have used for decades to travel hunt and fish have to be adjusted as whole roads have sunk it is also dangerous as you never know where the next crater will formour ecosystem is changing quickly animals such as sables that i have never seen before in my life have appeared in the tundra and now we also have to deal,routes that we have used for decades to travel hunt and fish have to be adjusted as whole roads have sunk it is also dangerous as you never know where the next crater will formour ecosystem is changing quickly animals such as the little red frog have already become extinct and the black-throated finch has disappeared from,1
authenticity to his performance as it does with several other of the cast who are also former soldiers that said director milan chams’s script cowritten with giriraj ghimire is chock full of cliches and cornball sentimentality – which will possibly make this reassuringly familiar for its intended audiencethe opening framing has an," authenticity to his performance as it does with several other of the cast who are also former soldiers that said director milan chams’s script cowritten with giriraj ghimire is chock full of cliches and cornball sentimentality, the film’s authenticity to its subject matter is all the more",0
today high energy prices are one of the leading factors driving inflation and those prices are getting embedded into every facet of daily life most obviously at the gas pump but also in delivery costs that affect everything from produce to paper towels meanwhile exxonmobil quadrupled last year’s figures with 1785bn shell beat,today high energy prices are one of the leading factors driving inflation and those prices are getting embedded into every facet of daily life most obviously at the gas pump but also in delivery costs that affect everything from produce to paper towels. but the price of oil has plummet,1
malicious link sometimes over the course of several emails and other online interactionsin one case the iranian group dubbed charming kitten held a fake zoom meeting with their target and shared the malicious link “in the chat bar during the phone call” the ncsc said sometimes two or more fake personas are used in a carefully crafted effort to convince a,"malicious link sometimes over the course of several emails and other online interactions in one case the iranian group dubbed charming kitten held a fake zoom meeting with their target and shared the malicious link “in the chat bar during the phone call,” the report says. in another case, the group sent an email with a link that was",1
to many of the conversations i have with winemakers these days time and again i’m told that it’s impossible in many if not most years to make the wines in the style they used to make cropdestroying weather events that were considered extreme just a decade ago are now to be expected each year that passes brings them closer to the point where,"to many of the conversations i have with winemakers these days time and again i’m told that it’s impossible in many if not most years to make the wines in the style they used to make crop destroying weather events are increasingly common in many parts of the world, and the wine industry is no exception. the wine industry has always",1
ia is poised for a catastrophic fire season experts say its plan isn’t nearly enoughread morethis year large swaths of california including most of the north the length of the sierra nevada mountains much of southern california and the mojave desert have seen their driest wet seasons in more than 40 years,ia is poised for a catastrophic fire season experts say its plan isn’t nearly enough read more this year large swaths of california including most of the north the length of the sierra nevada mountains and the inland valley are expected to be in the grips of a historic dr,1
key lyric “i’m going solo” it’s a blessed relief when they reunite for futuristic military anthem kill this love – but while its accompanying video is an expensive visual feast its performance here feels disappoint ingly basic with the four backing dancers doing their best to fill the stage while there are brilliant moments throughout – the e,key lyric “i’m going solo” it’s a blessed relief when they reunite for futuristic military anthem kill this love – but while its accompanying video is an expensive visual feast its performance here feels disappointingly stale. the band’s first full-length since 2010’s killer trail,0
couples and cash how to break the silence on money worries from rows over the rising cost of the weekly food shop and heating bills to spending on extras such as nights out money problems caused by the cost of living crisis can put a strain on even the most loving relationshipthe website counselling directory says there has been,"couples and cash how to break the silence on money worries from rows over the rising cost of the weekly food shop and heating bills to spending on extras such as nights out money problems caused by the cost of living crisis are causing tensions in couples across the uk, according to a survey.a",1
river on one side and a fence on the other was more than ankledeep in mud i traversed it with exaggerated care just about avoiding a spectacular debacle and with a sense of relief turned on to the old coach road towards home cutting across the top field i climbed over the final stile – holding on to the narrow holly,"river on one side and a fence on the other was more than ankledeep in mud i traversed it with exaggerated care just about avoiding a spectacular debacle and with a sense of relief turned on to the old road. it was a little after midday and the sun was beating down, but i was in",1
scott morrison is setting up another fake fight on a carbon ‘tax’  katharine murphy if you’ve been paying attention over the past decade or so you may have noticed that opponents of climate action in australia spend a lot of time talking about things that don’t exist tony abbott pioneered this technique by winning,scott morrison is setting up another fake fight on a carbon ‘tax’  katharine murphy if you’ve been paying attention over the past decade or so you may have noticed that opponents of climate action in australia have a tendency to get their facts wrong. they’ll tell you that austral,0
en numbers before new crops were planted but populations have well and truly rebounded in some areas since the autumn floods this led the nsw farmers association and the country women’s association of nsw to label the plague an urgent economic and health emergency and demand government interventionin response the state government has lodged an emergency request with,en numbers before new crops were planted but populations have well and truly rebounded in some areas since the autumn floods this led the nsw farmers association and the country women’s association of nsw to label the plague an “unmitigated disaster” for the state’s farmers. “we’,1
Loneliness which is no pleasure at all there are more than a million older people in england whose lives are blighted by loneliness – and now we have christmas rubbing it in as usual there is nothing more miserable than sleep ing waking eating and doing more or less everything alone – especially for anyone single separated or widowed and in poor health,Loneliness which is no pleasure at all there are more than a million older people in england whose lives are blighted by loneliness – and now we have christmas rubbing it in as usual there is nothing more miserable than being alone at this time of year. there are 1.2 million older people in england.,0
was their absolute commitment to nonviolent civil disobedience – the most stringent rule of xr in particular – which left fossil capital nothing to fear from public opinion in bourgeois states where “capitalist property has the status of the ultimate sacred realm”instead of disruptive protests and mass rallies mal,"was their absolute commitment to nonviolent civil disobedience – the most stringent rule of xr in particular – which left fossil capital nothing to fear from public opinion in bourgeois states where “capitalist property” is protected by the state. how could the government in britain,",0
beginning” of fixing the “abhorrent” practice of forcibly fitting prepayment meters into vulnerable customers’ homeshe said “people will have understandably been shocked and appalled at how vulnerable people’s homes have been invaded and prepayment meters installed against their wishes – and suppliers are only at the beginning of correcting this,beginning” of fixing the “abhorrent” practice of forcibly fitting prepayment meters into vulnerable customers’ home she said “people will have understandably been shocked and appalled at how vulnerable people’s homes have been forced to be fitted with prepayment meters” after a “horrific” investigation by,1
me much the canadian singer gave the genre a new lease of life paving the way for the likes of leann rimes carrie underwood and – later – one taylor swift however vocal issues lyme disease and a messy divorce saw her career stall unsurprisingly now – twain’s first album in 15 years,"me much the canadian singer gave the genre a new lease of life paving the way for the likes of leann rimes carrie underwood and – later – one taylor swift however vocal issues lyme disease and a messy divorce left the 25-year-old,",0
pet dog cat or ferret”the inclusion of ferrets in this list really does show that the government takes the interests of northerners into account in its policies don’t you think unfortunately there is no mention of what to do if you want to travel with your ferret down your trousers or up your jumper – but it’s early days so no,pet dog cat or ferret”the inclusion of ferrets in this list really does show that the government takes the interests of northerners into account in its policies don’t you think unfortunately there is no mention of what to do if you want to buy a pet cat or dog. the only other animal in the list is a ferret,0
of the paris agreement and avoid huge impacts on billions of people as well as massive biodiversity loss there will have to be drastic changes to the way we power our societies move around grow much of our food and look after the natural world including oil companies in funds that are marketed as protecting the environment won’t help that transformation – it will,"of the paris agreement and avoid huge impacts on billions of people as well as massive biodiversity loss there will have to be drastic changes to the way we power our societies move around grow much of our food and look after the rest of nature to avoid a climate catastrophe, scientists say. in a study published on",0
cannot continue to wait“my task is to help the club to create a base and then to try to improve” he said “if you say to me ‘the challenge for you is to win the premier league to win the champions league’ this is not the task in this moment“i signed a contract in november  and found the club in a difficult position for many reasons,"cannot continue to wait“my task is to help the club to create a base and then to try to improve” he said “if you say to me ‘the challenge for you is to win the premier league to win the champions league’ this is a huge challenge, but i think the task is to create a base. that’s a huge task in",1
wasn’t a hoary old seasonal favourite a longstanding party anthem or one of the year’s biggest hits it was chantaje a spanishlanguage reggaetoninfluenced track by shakira featuring a guest appearance from her fellow colombian singersongwriter maluma chantaje is a great song – tense infectious and with,wasn’t a hoary old seasonal favourite a longstanding party anthem or one of the year’s biggest hits it was chantaje a spanish language reggaeton influenced track by shakira featuring a guest appearance from rapper luis fonsi that became a global chart hit in ,1
williams share their experience of the evening ‘it was bennett in his natural habitat’ charlotte he was greeted with such an outpouring of love from a packed theatre there were hundreds of people there and the event was sold out this is a man who uses a typewriter rather than a computer and used to keep his manuscripts in the fr,"williams share their experience of the evening ‘it was bennett in his natural habitat’ charlotte he was greeted with such an outpouring of love from a packed theatre there were hundreds of people there and the event was well-attended, the audience was full and there was a buzz in the air, even though it was",1
visitors started brightly with the pace of luis díaz on the left and creativity of otávio on the right allied to the aerial strength of mehdi taremi unsettling a makeshift home defence their good work was constantly undermined by a poor finish final ball,visitors started brightly with the pace of luis díaz on the left and creativity of otávio on the right allied to the aerial strength of mehdi taremi unsettling a makeshift home defence their good fortune was that the match began in the most fav,0
ina bokova the head of the un cultural organisation unesco had failed to win enough support in the first five straw polls held by the security council finishing sixth out of nine in the latest ballot on monday georgieva put out a statement from brussels on wednesday saying she accepted the nomination she is expected to appear before the,In a bokova the head of the un cultural organisation unesco had failed to win enough support in the first five straw polls held by the security council finishing sixth out of nine in the latest ballot on monday georgieva said the council had “not yet reached a consensus” on her candidacy. ,0
across the world at this critical time of looming climate catastrophe shouldn’t that be at the top of any list of considerationshilary evanstwickenham london have an opinion on anything you’ve read in the guardian today please email us your letter and it will be considered for publication 20210528,"across the world at this critical time of looming climate catastrophe shouldn’t that be at the top of any list of consideration shilary evanst wickenham london have an opinion on anything you’ve read in the guardian today? write to us at guardian letters, letters@the",1
11 months for the portuguese police to lift their categorisation of the couple as arguidos – translated from portuguese as “named suspects” or “formal suspects” the initial police investigation in the disappearance of madele ine mccann in may 2007 from a holiday apartment in praia da luz was also,"11 months for the portuguese police to lift their categorisation of the couple as arguidos – translated from portuguese as “named suspects” or “formal suspects” the initial police investigation in the disappearance of madeleine catherine mccarthy-scott, the 10",0
are those that are refurbished or reconditioned which broadly come in two different types manufacturerrefurbished and retailerrefurbishedthe first is a device that has been fully reconditioned to be “as new” typically including a new battery and often a new outer casing these are the most expensive type of secondhand phone and usually come with,are those that are refurbished or reconditioned which broadly come in two different types manufacture refurbished and retailer refurbished the first is a device that has been fully reconditioned to be “as new” typically at a discount to the retail price. the second is a device that has been reconditioned but may,0
30 in the us in a further worrying sign for companies who make money from digital advertising more than 40 of those surveyed by globalwebindex said they were interested in blocking ads on their mobiles in the future globalwebindex research and insight director jason mander said “arguably the most striking aspect of this data is,"30 in the us in a further worrying sign for companies who make money from digital advertising more than 40 of those surveyed by global webindex said they were interested in blocking ads on their mobiles in the future. the survey, which polled 100 executives, found that",0
had just got big deals it’s really dangerous to be envious of other people’s success but i started to worry that maybe my shelf life was running out” she says “i’d written like 20 books and never broken through” she went for a beer with an editor at harpercollins who told her she wasn’t being,had just got big deals it’s really dangerous to be envious of other people’s success but i started to worry that maybe my shelf life was running out” she says “i’d written like 20 books and never sold more than a few thousand copies each time. i’d been a bestseller,1
negotiations were conducted” to ensure the right of the captain to take part in the search “at this moment we have no other explanation but that the incident at heathrow is in one way or another connected with the hostile policy that the uk government is conducting with regard to russia” the statement continued both aeroflot and ba fly the londonmos,"negotiations were conducted” to ensure the right of the captain to take part in the search “at this moment we have no other explanation but that the incident at heathrow is in one way or another connected with the hostile policy that the uk has adopted”, said the spokesperson for the russian foreign ministry,",1
support rose to acclaim him as he headed towards the bench moments earlier the 24yearold midfielder had been denied by a save from the goalkeeper ciprian tatarusanu after catching a volley with glorious sweetness and it had been his welltaken goal in the 25th minute that put totten,support rose to acclaim him as he headed towards the bench moments earlier the 24 yearold midfielder had been denied by a save from the goalkeeper ciprian tatarusanu after catching a volley with the help of a teammate. tatarusanu had made a superb,1
landholding public bodies to upgrade footpaths to bridleways and to dedicate new ones to enable all to have safe offroad exercise facilitiescatriona cookscarborough north yorkshire have an opinion on anything you’ve read in the guardian today please email us your letter and it will be considered for publication 20220819,landholding public bodies to upgrade footpaths to bridleways and to dedicate new ones to enable all to have safe offroad exercise facilities catriona cooks carborough north yorkshire have an opinion on anything you’ve read in the press. so we’re not surprised to be hearing the latest.,0
at that pope has played only three test innings jonny bairstow he is a certainty for sri lanka but while he is playing at the ageas bowl as a batsman only he cannot really be regarded as a specialist such is his determination to keep keeping wicket so it is root plus four an others as the selectors,at that pope has played only three test innings jonny bairstow he is a certainty for sri lanka but while he is playing at the ageas bowl as a batsman only he cannot really be regarded as a genuine test player. jonny bairstow has made a great impression in the first test,0
