Outdated_content,Updated_content,Temporal_validity_Tag
some of the appeal hearings earlier this month and have since been called upon to explain themselves to avoid potential charges of contempt of court ministers greg hunt and alan tudge and assistant minister michael sukkar who all criticised the court for not handing down tougher sentences on people convicted of terrorism offences apologised to the court,some of the appeal hearings earlier this month and have since been called upon to explain themselves to avoid potential charges of contempt of court ministers greg hunt and alan tudge and assistant minister michael sukkar who all criticised the federal government’s plan to create a national office of water quality said they had not,1
with the last opening on election night later this year a writer with a résumé that encompasses half a century nelson wrote his first play as a theatremad adolescent his career encompasses radio plays in phil adelphia sweeping historical works for the royal shakespeare company a tonywinning book for the musical version of the,"with the last opening on election night later this year a writer with a résumé that encompasses half a century nelson wrote his first play as a theatremad adolescent his career encompasses radio plays in philadelphia, a one-man show in new york, and a novel, the",1
saturday and with mousa dembélé and tom carroll injured mason senses opportunity mason also missed six weeks at the start of the season with the knee injury he picked up at sunderland in the act of scoring the winner and the upshot is that he feels fit and fresh for the runin he is also a symbol of the greater strength,"saturday and with mousa dembélé and tom carroll injured mason senses opportunity mason also missed six weeks at the start of the season with the knee injury he picked up at sunderland in the act of scoring the decisive goal in the playoff semi-final against burton albion, but he is now back in the",1
these services “carillion is a warning not a direct parallel but there are some similarities in the profit warning and the way the shares are going” he said the move by barnet to consider its position underscores growing concerns over the sust ainability of mass outsourcing after decades of government and local councils picking private partners to run public,"these services “carillion is a warning not a direct parallel but there are some similarities in the profit warning and the way the shares are going” he said the move by barnet to consider its position underscores growing concerns over the sustainability of outsourced public services, which are often subject to a lack",0
air feels like an oven this time of year in the bard valley the temperature has reached over 110f every day for weeks now – some days coming close to 120f – forcing most residents of the agricultural valley nestled at the intersection of the arizona california and mexican borders inside but the date palms at sun garden,"air feels like an oven this time of year in the bard valley the temperature has reached over 110f every day for weeks now – some days coming close to 120f – forcing most residents of the agricultural valley to stay inside. with no relief in sight, the bard valley is facing a dire heat",1
24 january is right to highlight how us sanctions have aggravated the economic crisis in venezuela perhaps by deliberate policy us actions follow a predictable pattern just over a year ago another latin american country riven by economic and social problems descended into widespread street protests and violence following a disputed election with dozens,"24 january is right to highlight how us sanctions have aggravated the economic crisis in venezuela perhaps by deliberate policy us actions follow a predictable pattern just over a year ago another latin american country riven by political crisis, inflation, and economic stagnation, was hit with a series",1
offsets by biggest provider are worthless analysis shows 18 january makes uncomfortable reading for enthusiasts of naturebased solutions to climate change while forest protection should provide a winwin situation benefiting both biodiversity and climate it can too easily become loselose because carbon offsets allow emissions to continue worsening global heating and threatening,offsets by biggest provider are worthless analysis shows 18 january makes uncomfortable reading for enthusiasts of naturebased solutions to climate change while forest protection should provide a winwin situation benefiting both biodiversity and climate it appears that the big players in the carbon market are not so keen on the idea.,0
for this steampunk fairytale “for ages the homeland of the fae was a place of myth and legend until the many empires of man arrived and warred for control of its riches …” it goes on for a supre mely confident length of time the short version is that the burgue and the pact were at war in fairyland,"for this steampunk fairytale “for ages the homeland of the fae was a place of myth and legend until the many empires of man arrived and warred for control of its riches …” it goes on for a supremely long time. this is a very long film, but it’s a beautifully imag",1
ome in shades of clotted cream rose gold shagreen and candyfloss the first thing that strikes you as you walk through the copse of “fan” chairs on the colonnaded terrace under a firework display of glittering lampshades is a vast bar fashioned from polished pink concrete toto we’,ome in shades of clotted cream rose gold shagreen and candyfloss the first thing that strikes you as you walk through the copse of “fan” chairs on the colonnaded terrace under a fire-engine red awning at ome’s new restaurant in westbourne,0
dwickherdwick sheep are not only part of the landscape here – there are cultural events centred around them the meets held at this time of year may be entered by any shepherd from the parish of the meet or any adjoining parish they were originally set up for shepherds to walk to with their tips their rams they’re called tu,"dwickherdwick sheep are not only part of the landscape here – there are cultural events centred around them the meets held at this time of year may be entered by any shepherd from the parish of the meet or any adjoining parish, and the sheep are driven through the fields to the meet. the meet is held in",0
have won every single away fixture when united went a goal down here they conceded a second five minutes later and lost 21 leaving josé mourinho to complain that the players not the manager should appear in front of the media to explain it in stark contrast guardiola described city’s response as one of the more satisfying results of his time,have won every single away fixture when united went a goal down here they conceded a second five minutes later and lost 21 leaving josé mourinho to complain that the players not the manager should appear in front of the media. but there was a long way to go for his side to be written off. they were still,0
1974 many leftists have expressed consternation by sunday 22000 people were trapped in greece with an estimated 6000 stuck at the macedonian border after restrictions were tightened – and frontiers effectively sealed to all but syrians – by balkan nations along the migrant route while,1974 many leftists have expressed consternation by sunday 22000 people were trapped in greece with an estimated 6000 stuck at the macedonian border after restrictions were tightened by the government. the border was closed on sunday after a large group of,1
and undercut the uk leaving british industry at a severe disadvantagethis is known as carbon leakage as greener industries in the domestic market lose out and the carbon is emitted overseas insteada cbam could level the playing field by imposing tariffs or taxes on imports of such products and has broad support among many economists,and undercut the uk leaving british industry at a severe disadvantagethis is known as carbon leakage as greener industries in the domestic market lose out and the carbon is emitted overseas insteada cbam could be the worst thing that could happen to british industry. that’s because the uk could be at,0
three graces at a voguing contest they semaphore to one another bow and curtsey and move on in a choreography at once formal and jokey poised and ironic even their necklaces of big white baubles are a reminder of other times other fashions not so much renaissance pearls as maggieinat,"three graces at a voguing contest they semaphore to one another bow and curtsey and move on in a choreography at once formal and jokey poised and ironic even their necklaces of big white baubles, and the stiff, starched shirts and skir",0
still use extracts from it when i teach about vision loss and what it does to people about the fear and the darkness he’s still read and he’s known through his writing by groups of nurses who aren’t old enough to remember those times otherwise he’s still educating still admired and still remembered janet marsden professor of ophth,still use extracts from it when i teach about vision loss and what it does to people about the fear and the darkness he’s still read and he’s known through his writing by groups of nurses who aren’t old enough to have experienced blindness but have a relative who is.he’s read to people,1
last winter and verified it up close when he floated through fresh powder alongside his wife and three sons at the popular winter park resortbut one season of aboveaverage snowfall wasn’t enough to refill the dwindling reservoir he relies on to irrigate his pumpkins he received news this spring that his water delivery would be about half,"last winter and verified it up close when he floated through fresh powder alongside his wife and three sons at the popular winter park resortbut one season of aboveaverage snowfall wasn’t enough to refill the dwindling reservoirs. “we’re having the same conversation we had last year,” said john hart",0
plans for the rfa extensions yesterday the senate passed an order for the production of documents from greens senator janet rice rice is seeking the release of all documents relating to the rfas produced for the three meetings and any subsequent meet ings the government has a week to respond after receiving ruston’s letter the board of the npa nsw sought legal,plans for the rfa extensions yesterday the senate passed an order for the production of documents from greens senator janet rice rice is seeking the release of all documents relating to the rfas produced for the three meetings and any subsequent meetings with the department of environment and energy. she wants to know what the rfas say about the,0
songs of the summer 2018 our writers pick their favourite tracks ariana grande – no tears left to cry there is a fine art to the ballad banger from gloria gaynor’s i will survive to rob yn’s dancing on my own they require equal parts defiant survivalism and a bruised vulnerability no,songs of the summer 2018 our writers pick their favourite tracks ariana grande – no tears left to cry there is a fine art to the ballad banger from gloria gaynor’s i will survive to robyn’s all to myself. it is a song that can be both a,1
the world bank as it helps to “derisk” financing to developing countries which are often penalised by higher than normal interest rates when they try to raise finance privatelyfor instance if an oil developer in nigeria wanted to import drilling or refining equipment trade finance could provide a guarantee to the equipment manufacturer that the payment for the goods would,the world bank as it helps to “derisk” financing to developing countries which are often penalised by higher than normal interest rates when they try to raise finance privatelyfor instance if an oil developer in nigeria wanted to import equipment from europe to build a new platform it would have to pay a premium of around 2 percentage,1
whitehaven in the northwest of england found itself at the centre of a political storm in may when the levelling up housing and communities secretary michael gove gave his approval for the uk’s first new deep coalmine in more than 40 years just outside the townbut whitehaven may soon be known for more than climatewrecking,whitehaven in the northwest of england found itself at the centre of a political storm in may when the levelling up housing and communities secretary michael gove gave his approval for the uk’s first new deep coalmine in 30 years. the decision to allow the whitehaven mine to open in,0
icious interesting and fun it’s also really easy to make the most important thing is to use organic bananas to avoid pesticides and fungicides the second most important thing is that your banana skins are superripe with large brown spots which will guarantee a sweeter end resultyour bananacon should be eaten immediately but any lefto,icious interesting and fun it’s also really easy to make the most important thing is to use organic bananas to avoid pesticides and fungicides the second most important thing is that your banana skins are superripe with brown spots and black streaks the third most important thing is that you have a,0
diy she made crass look like the architects of the north american free trade agreement the latter album was recorded solo entirely on christmas day 2001 and affixed with the sleevenote instruction “when you are listening to this little disk try to think that you are in on a secret” these were real rabbithole records surrealist advent,"diy she made crass look like the architects of the north american free trade agreement the latter album was recorded solo entirely on christmas day 2001 and affixed with the sleevenote instruction “when you are listening to this album, imagine you are in a snowstorm.” the song that best captures that sens",1
iron particles from saharan dust were the main particle pollutants in all three cities on saturday 20 february and that the dust was breathed by londoners for the next two dayssaharan dust events are common in mediterranean countries it is also carried west on atlantic trade winds dust from north africa fertilises,"iron particles from saharan dust were the main particle pollutants in all three cities on saturday 20 february and that the dust was breathed by londoners for the next two dayssaharan dust events are common in the uk and europe, but the amount of dust in the atmosphere is unusually",1
ôr or hat light the installation that made the shortlist for the va’s £25000 prize and appeared at last year’s venice biennale in it multiple woollen caps are lit from within and carefully arranged in clusters the hats are simple handknitted and made from recycled wool “about eight years ago i bought,ôr or hat light the installation that made the shortlist for the va’s £25000 prize and appeared at last year’s venice biennale in it multiple woollen caps are lit from within and carefully arranged in a triangular formation on the floor. the caps are arranged in a triangle with,0
“but then there is the secondary moral dilemma of the kinds of emissions behind having a child and that sounds cold and sort of more  data than emotion but that was a big factor for us”uncertainty about the future and concerns about the ecological impact of the growing human population were key factors also identified by research according to hope dill,"“but then there is the secondary moral dilemma of the kinds of emissions behind having a child and that sounds cold and sort of more  data than emotion but that was a big factor for us”uncertainty about the future of the planet, the carbon footprint of a child and the possibility that they would not be able to enjoy",1
must for the time being share the cramped apartment they are selling both have found new partners and now quarrel endlessly it is a truly horrible atmosphere for their 12yearold son alyosha matvey novik ov who at some level realises that he is somehow at fault – by having a child too early the couple effectively destroyed their,"must for the time being share the cramped apartment they are selling both have found new partners and now quarrel endlessly it is a truly horrible atmosphere for their 12yearold son alyosha matvey novikov, who has been forced to share a cramped apartment with two men he does not know. “it",0
s all i was thinking about and then that came along and obviously i was delighted to get the news there were a lot of emotions for me in that particular week and both turned out to be very good news so let’s hope that car ries on into the summer” one of the hallmarks of southgate’s tenure as manager so far has been the,s all i was thinking about and then that came along and obviously i was delighted to get the news there were a lot of emotions for me in that particular week and both turned out to be very good news so let’s hope that carries on and we can keep going in that direction so i think what’s really important is,1
are currently working full or parttime an increase of 137 over the past 10 years over three times more men aged 70 and above are working fulltime compared with a decade ago 113513 up from 36302 in 2009 the number of women aged 70 and above who are,are currently working full or parttime an increase of 137 over the past 10 years over three times more men aged 70 and above are working fulltime compared with a decade ago 113513 up 33% over the past 10 years an increase of,0
s domestic life “even if we have power in our phones and pads we have agreed as a family to sit by candlelight and take the opportunity to play games like in the old days” he saysin early 1972 when blackouts led to some homes being dark for nine hours at a time stoic britons sat for haircuts beneath,"s domestic life “even if we have power in our phones and pads we have agreed as a family to sit by candlelight and take the opportunity to play games like in the old days” he saysin early 1972, the first power cuts hit the united kingdom. the first was in london.",1
update on the people action and ideas driving the protest movement in the us if you’re not already receiving it by email subscribe end family separation hundreds of thousands of people are expected to gather in washington dc today in what could be one of the biggest protests since the women’s march in 2017 the aclu said more than,update on the people action and ideas driving the protest movement in the us if you’re not already receiving it by email subscribe end family separation hundreds of thousands of people are expected to gather in washington dc today in what could be one of the largest protests in the us in recent history. the people action,0
ant corruption once it took over military posts in august the new agreement negotiated in jeddah and riyadh over more than a month includes new measures to crack down on corruption and ensure a more even allocation of resources by yemen ’s central bank the draft agreement postpones the secession issue until the war with the houthis has been,"ant corruption once it took over military posts in august the new agreement negotiated in jeddah and riyadh over more than a month includes new measures to crack down on corruption and ensure a more even allocation of resources by yemen’s government, the kingdom of saudi arabia said on thursday.the",1
as the annual meeting is known usually by alternating among developed and developing countries and different continents though the rules can be somewhat flexible next year’s host was supposed to be brazil but the incoming president jair bolsonaro is hostile to the paris agreement and has withdrawn the offer chile and costa rica are understood to be considering alternative bidss,as the annual meeting is known usually by alternating among developed and developing countries and different continents though the rules can be somewhat flexible next year’s host was supposed to be brazil but the incoming president jair bolsonaro is hostile to the ngo movement and has been a vocal critic of the annual meeting. so it is now,0
evidence about who was guilty of feeding pigeons wolverhampton used covert surveillance to check on the sale of dangerous toys and car clocking slough to aid an investigation into an illegal puppy farm and westminster to crack down on the selling of fireworks to children meanwhile lancaster city council used the act in 2,evidence about who was guilty of feeding pigeons wolverhampton used covert surveillance to check on the sale of dangerous toys and car clocking slough to aid an investigation into an illegal puppy farm and westminster council is considering a ban on the use of pigeons in the city centre wolverham,0
britain this is not a windup change your clocks to eu time  nigel gardner this weekend as you perhaps struggle to remember to put your watch back an hour it may have escaped your attention that the eu has launched ambit ious plans to put an end to summer and winter time european commission president jeanclaude juncker proudly announced that,britain this is not a windup change your clocks to eu time  nigel gardner this weekend as you perhaps struggle to remember to put your watch back an hour it may have escaped your attention that the eu has launched ambitious plans to abolish time zones in europe and make a single time zone the norm. it,0
ninth circuit court of appeals ruled that limits on largescale magazines do not violate second amendment rights nor notably limit the ability to defend oneself the ruling supports the constitutionality of california laws that ban magazines holding 10 or more rounds of ammunition the ruling noted that weapons with highcapacity,ninth circuit court of appeals ruled that limits on largescale magazines do not violate second amendment rights nor notably limit the ability to defend oneself the ruling supports the constitutionality of california laws that ban magazines with a capacity to hold more than ten rounds of am,1
control having things taken away essentially your capacity to meet the demands of the world and your family’s needs can be profoundly threatening and can evoke in any of us deep anxieties”he says it is vital for a couple to have resilience which means being able to talk think and solve problems together “our families and couple relationships are our most,control having things taken away essentially your capacity to meet the demands of the world and your family’s needs can be profoundly threatening and can evoke in any of us deep anxieties”he says it is vital for a couple to be able to be able to control their own lives and not feel that their partner is constantly controlling them,0
to 150mm of rainfall expected on tuesday and between 60mm and 80mm on wednesday and thursday overall parts of northern south korea could have cumulative totals between mond ay and thursday in excess of 350mm to 400mmsign up to first edition,to 150mm of rainfall expected on tuesday and between 60mm and 80mm on wednesday and thursday overall parts of northern south korea could have cumulative totals between monday and wednesday of 150mm to,0
almost 600m nhs home covid tests unaccounted for auditors reveal almost 600m lateral flow tests given to the public in england may not yet have been used according to a report that says the hugely expensive testandtrace system is still bedevilled by problems the national audit office said nhs test,almost 600m nhs home covid tests unaccounted for auditors reveal almost 600m lateral flow tests given to the public in england may not yet have been used according to a report that says the government’s handling of the pandemic has been “poor and disappointing,0
ended up paying the blades £20m in compensation following an outofcourt settlement however while the coverage down the years has largely focused on united being cheated out of a premier league place something lost in the conversation is how west ham’s dream turned into a nightmare far from helping them challenge the elite signing tevez and mascherano,ended up paying the blades £20m in compensation following an outofcourt settlement however while the coverage down the years has largely focused on united being cheated out of a premier league place something lost in the conversation is how west ham were the first club to be caught out by the blades’ ruthless,0
can be a boon cackling gangs might make a date of it staggering in with supplies so they can neck a shot every time they hear a synth the casually curious fork out just to check the critics were correct appealing to rubberneckers is now the distributor’s key strategy billing cats as “the mustsee experience of,"can be a boon cackling gangs might make a date of it staggering in with supplies so they can neck a shot every time they hear a synth the casually curious fork out just to check the critics were correct appealing to a certain kind of gothic nostalgia, the first few",0
in us history – may hold the seeds to a much bigger and longerterm picture a radical contraction of the us federal government by privatizing government functions such as air traffic control and airport security “the democrats have basically just started a new conversation on the political right about how to privatize the heck out of all of that” said rahe,"in us history – may hold the seeds to a much bigger and longerterm picture a radical contraction of the us federal government by privatizing government functions such as air traffic control and airport security “the democrats have basically just started the process of turning the country into a banana republic,” the us secretary of state, nomine",0
