Outdated_content,Updated_content,Temporal_validity_Tag
booted on virgin east coast’s redeye it went the way of flying cars and robots doing the vacuuming partly this is down to the welladvertised deficiencies in broadband networks sometimes you hear radio inter views via skype that sound as though they might as well have been done using two cocoa tins but more likely it,booted on virgin east coast’s redeye it went the way of flying cars and robots doing the vacuuming partly this is down to the welladvertised deficiencies in broadband networks sometimes you hear radio interviews with people who are so frustrated by their internet connection that they’re considering buying a land,1
pollution does not get worse outside the zone as a result of diverting vehicles instead the experience from london and cities in germany show the cleaner vehicles are also used in the surrounding area spreading the benefit the inner london ulez also induced accelerated air pollution improvements on the boundary roadsthird it is often said the zone charges unfairly,"pollution does not get worse outside the zone as a result of diverting vehicles instead the experience from london and cities in germany show the cleaner vehicles are also used in the surrounding area spreading the benefit the inner london ulez is a success and has been for some time, according to the latest report from the city",1
of medical advice and stick to stuff with no discernible relationship to anything living the irnbru dietmy last option learn to photosynthesise if they are so clever perhaps plants can teach us emma beddington is a guardian columnist 20230116,of medical advice and stick to stuff with no discernible relationship to anything living the irnbru dietmy last option learn to photosynthesise if they are so clever perhaps plants can teach us emma beddington is a guardian columnist,1
spy on peaceful people doing their bit for the planet”the met said it could “neither confirm nor deny any chis activity in relation to extinction rebellion”stephens who was liaising with the police on behalf of xr at the time of the approach said it was immoral and a waste of resources to target people protest,spy on peaceful people doing their bit for the planet”the met said it could “neither confirm nor deny any chis activity in relation to extinction rebellion”stephens who was liaising with the police on the incident said: “the met is neither confirming nor denying any chis activity in relation to ext,0
iodiversity of what she now calls “the eighth continent” – the world of the treetops – at exactly the time in history this biodiversity was becoming imperilledmeg lowman author of the arbonauts in january 1979 making her debut in a coachwood tree in the royal national park near sydney photograph hugh c,"iodiversity of what she now calls “the eighth continent” – the world of the treetops – at exactly the time in history this biodiversity was becoming imperilledmeg lowman author of the arbonauts in january 2015, the uk’s first female astronaut, christina",0
wickets yorking inform veteran marlon samuels for a golden duck but the proteas relinquished the upper hand as bravo 102 and kieron pollard 62 shared a 15 6run stand bravo struck 12 fours and four sixes off 103 balls in what was his,wickets yorking inform veteran marlon samuels for a golden duck but the proteas relinquished the upper hand as bravo 102 and kieron pollard 62 shared a 150-run partnership to take the first-class series to a close with,1
leading questions i was i think a compulsive liar in my late teens and early 20s i had in some ways a pretty awful adolescence i was fortunate to meet a young man who was kind attent ive and exactly who i needed at that time he loved me dearly and i abused that i lied to him with,leading questions i was i think a compulsive liar in my late teens and early 20s i had in some ways a pretty awful adolescence i was fortunate to meet a young man who was kind attentive and patient. he encouraged me to be myself and to express my thoughts and feelings. he was a,1
refunds and swaps of tickets have only been allowed after the purchase of a new ticket for the preferred day and providing the new order contains the same number of tickets as the original this entails an extra cost for some tickethold ers as the cheapest seats are no longer availablethe organisation has not provided a real reason for the revised lineup only,"refunds and swaps of tickets have only been allowed after the purchase of a new ticket for the preferred day and providing the new order contains the same number of tickets as the original this entails an extra cost for some ticketholders. but a new uk government-backed scheme is set to change that, as the uk government",1
people cancelling their bookings” “i cannot be any clearer than that” he said “i am not even bothering to be critical of that because i cannot change it people will make judgments i’m asking them to make a slightly different judgment” andrews urged victorians to honour their vaccine bookings saying an appointment for a,"people cancelling their bookings” “i cannot be any clearer than that” he said “i am not even bothering to be critical of that because i cannot change it people will make judgments i’m asking them to make a judgement about me.” the uk prime minister, boris johnson",0
taught to be demure ball’s romeo is one of the lads caught up in exceptional circumstances when the pair meet their reactions are spontaneous at one point ball goes as if to kiss cuthbertson’s neck and she laughs caught offguard when he lifts her above his head she looks surprised to find herself there amazed by,"taught to be demure ball’s romeo is one of the lads caught up in exceptional circumstances when the pair meet their reactions are spontaneous at one point ball goes as if to kiss cuthbertson’s neck but it’s more than a little awkward. the next day he writes to his sister, who",1
is year large swaths of california including most of the north the length of the sierra nevada mountains much of southern california and the mojave desert have seen their driest wet seasons in more than 40 years due to global heating the state is also warmer than it was during its deep drought in the late 19,"is year large swaths of california including most of the north the length of the sierra nevada mountains much of southern california and the mojave desert have seen their driest wet seasons in more than 40 years. the state is suffering its worst drought in recorded history, and the situation is so severe that",0
heavily in cultural reinvention from zimbabwe there’s a report on the prospects of new president emmerson mnangagwa while simon tisdall considers the other african strongmen nervously watching events in harare after robert mugabe’s sudden fall the weekly review has a long read on neoliberal,"heavily in cultural reinvention from zimbabwe there’s a report on the prospects of new president emmerson mnangagwa while simon tisdall considers the other african strongmen nervously watching events in the uk. meanwhile, africa’s cultural scene is thriv",0
717m to £418m in the three months to the end of june stripping out the impact of the oneoff £225m payment bt’s adjusted profits still fell by 2 to £ 178bn in its first quarter the company attributed this,717m to £418m in the three months to the end of june stripping out the impact of the oneoff £225m payment bt’s adjusted profits still fell by 2 to £717m in the three months,0
win in 2021 and lifting the odi world cup on home soil in 2015 will be the two memories i cherish the most” finch said “to be able to represent australia for 1 2 years and play with and against some of the greatest players of all time has been an incredible honour”he hangs,win in 2021 and lifting the odi world cup on home soil in 2015 will be the two memories i cherish the most” finch said “to be able to represent australia for 10 years and to have been able to win a world cup on home soil is a huge achievement.,0
those in their 70s are still working a significant increase from the one in 22 working 10 years ago “while we know that the over50s in general have been the driving force behind the uk’s impressive employment growth in recent years our deeper analysis shows the hard work and significant economic contribution made by the rapidly growing numbers of over,"those in their 70s are still working a significant increase from the one in 22 working 10 years ago “while we know that the over50s in general have been the driving force behind the uk’s impressive productivity growth in recent years, the scale of the increase in employment among older workers has been surprising,” says a",1
get laid beds and tuffnells are giving me nightmares over my creaky bed i bought a bedframe for £387 from a firm called get laid beds the price including delivery once assembled it creaked badly but fortunately the firm was happy to take it back and offer a refund the courier company it sent – t,get laid beds and tuffnells are giving me nightmares over my creaky bed i bought a bedframe for £387 from a firm called get laid beds the price including delivery once assembled it creaked badly and i could hear the springs rattling underneath. i returned it and bought a different,1
ambitious pipeline of onshore renewables that could deliver investment create jobs and power our lives in the most economic way possible – if the commitment of net zero is to be a reality i expect to see support from government to match it ” she said the tory party is under pressure to reverse its block on government support for new onshore windfarms,ambitious pipeline of onshore renewables that could deliver investment create jobs and power our lives in the most economic way possible – if the commitment of net zero is to be a reality i expect to see support from government to match it. the government’s own analysis shows that renewable energy is the cheapest way to meet our,0
boris johnson for “calling it as he sees it” the us ambassador to the uk has said responding to the new prime minister’s 2015 description of the us president as “frankly unfit to hold office” woody johnson said the relationship between the two would be “sensational” “i think they,boris johnson for “calling it as he sees it” the us ambassador to the uk has said responding to the new prime minister’s 2015 description of the us president as “frankly unfit for office” is “not a matter of concern”. the us embassy in,1
the worst of climate change 21 march 2023 unless this shortlived super climate pollutant is cut immediately the carbon budget for 15c – “beyond which” as she rightly reported “climate cha os will ensue” – is impossible and the paris agreement is out of reachdr al jaber wants near zero,the worst of climate change 21 march 2023 unless this shortlived super climate pollutant is cut immediately the carbon budget for 15c – “beyond which” as she rightly reported “climate chaos” – is likely to be breached. the un has warned that we are on,0
are no doubt as contemptuous of the throng as an airman is of enemy troops on the ground and the foxes from a forestry planting who sun themselves on a couch of blueberry are probably bored by the jackda ws’ hullabaloo 20210915,are no doubt as contemptuous of the throng as an airman is of enemy troops on the ground and the foxes from a forestry planting who sun themselves on a couch of blueberry are probably bored by the jackdaws who are,0
would be able to make ithaving dealt with the tricky issue of the postbrexit northern ireland protocol which many in washington viewed as vital to such a trip getting the green light sunak stressed there was an opportunity to “celebrate” the peace that followed the agreementhe said “i’ll be keen to invite  to,would be able to make ithaving dealt with the tricky issue of the postbrexit northern ireland protocol which many in washington viewed as vital to such a trip getting the green light sunak stressed there was an opportunity to “make ithanking for a second chance” to make it,0
50 minutes to about 30 minutes between leeds and manchester as well as £75m to develop plans for an 18mile road tunnel under the peak district to cut journey times between manchester and london however funding has only been put forward to draw up plans rather,50 minutes to about 30 minutes between leeds and manchester as well as £75m to develop plans for an 18mile road tunnel under the peak district to cut journey times between manchester and london however the plans are still at a very early stage.the,1
decided they would not have children back then her friends and family did not understand“when you tell people you didn’t want to have children that was a big social nono” she recalled “and then when they asked you why and you said for environmental reasons that was completely unheard of“like i remember my brotherinlaw laughed when i said that”but,"decided they would not have children back then her friends and family did not understand“when you tell people you didn’t want to have children that was a big social nono” she recalled “and then when they asked you why and you said it was because you didn’t want to be a mother, well that was a",0
20 cubic metres a day became exempt from licensing in 2005 under the water act the move instantly deregulated 22000 licences most of which were for agricultural or private water supply pur posesthe ea said “abstraction licences have conditions attached to them to ensure the environment and the rights of,20 cubic metres a day became exempt from licensing in 2005 under the water act the move instantly deregulated 22000 licences most of which were for agricultural or private water supply. it is estimated that more than 10000 licences were for “,1
this article is more than 10 months oldfour insulate britain members convicted after london street blockadethis article is more than 10 months old four climate activists who blockaded a street in london in a campaign to press the government to insulate homes have been found guilty of public nuisancea jury at inner l,this article is more than 10 months oldfour insulate britain members convicted after london street blockadethis article is more than 10 months old four climate activists who blockaded a street in london in january to protest against the expansion of a coal power plant have been convicted of contempt of,0
for the maximum amount of fish that should be caught when it comes to sharing the pie however the negotiators don’t agree on who gets what they almost always end up allocating themselves quotas that are far too high – and collectively end up fishing too muchthe result has been chaos an investigation,for the maximum amount of fish that should be caught when it comes to sharing the pie however the negotiators don’t agree on who gets what they almost always end up allocating themselves quotas that are far too high – and collectively end up fishing the oceans to the br,0
squabbling in westminster that will sign the death certificate of the labour party it is the alienation of the party from its base this referendum was a battle over globalisation and its discontents between those who have become the benefici aries of a boundarybusting neoliberal economy and those who have been left behind by it a few years back,squabbling in westminster that will sign the death certificate of the labour party it is the alienation of the party from its base this referendum was a battle over globalisation and its discontents between those who have become the beneficiaries of the global economy and those who have become its victims. the question was not about,1
abandoned its plan to ban dark roofs – aimed at reducing temperatures and energy costs for new homes – as the state’s new planning minister walks back ambitious sustainability measures announced by his predecessorformer planning minister rob stokes previously announced he would be tasking the department of planning and environment with implementing a requirement for lightercoloured roof,"abandoned its plan to ban dark roofs – aimed at reducing temperatures and energy costs for new homes – as the state’s new planning minister walks back ambitious sustainability measures announced by his predecessorformer planning minister rob venues has abandoned plans to ban dark roofs on new homes, in a move that has been",0
subscriptions have grown rapidly now numbering 16000 and bringing in 70000 monthly the group aligned with the brooklyn arm of the democratic socialists of america met on twitter where they gained followers for their offbeat humour and views on what is termed “left twitter” that led to a series,subscriptions have grown rapidly now numbering 16000 and bringing in 70000 monthly the group aligned with the brooklyn arm of the democratic socialists of america met on twitter where they gained an increasing following as they launched a new monthly newsletter and a podcast.a,1
iraqi inquiry needed into mosul killings  letters ghaith abdulahad’s extremely disturbing report on iraqi government soldiers torturing and coldbloodedly killing captives after this year’s battle for mosul should be urgently acted on after the liberation of mosul an orgy of killing 22,iraqi inquiry needed into mosul killings  letters ghaith abdulahad’s extremely disturbing report on iraqi government soldiers torturing and coldbloodedly killing captives after this year’s battle for mosul should be read by anyone who cares about human rights. ira,1
in europe will persist this week as high pressure continues to stagnate over western russia the cold weather is linked to a weak split polar vortex in the stratosphere which allowed high pressure to build across greenland last week this in turn led to arctic air flooding south across the uk on northerly winds the polar vortex is due to strengthen,"in europe will persist this week as high pressure continues to stagnate over western russia the cold weather is linked to a weak split polar vortex in the stratosphere which allowed high pressure to build across greenland last week this in turn led to a strong high pressure system in europe, with a cold front sweeping across the continent",1
pping them off ice floes – her own crew experienced similar behaviour from a pod of orca frustrated “after a particularly spectacular seal hunt” even more remarkably as my marine biologist colleague jeroen hoek endijk notes the sri lanka orcas were using it in equatorial waters where it could have no practical application so,"pping them off ice floes – her own crew experienced similar behaviour from a pod of orca frustrated “after a particularly spectacular seal hunt” even more remarkably as my marine biologist colleague jeroen hoekstra and i were on the ice-floe-bound research vessel orca, we",0
sheep shown in show red colour and those with natural colour sheep with the best mouth but there is only one breed – herdwickherdwick sheep are not only part of the landscape here – there are cultural events centred around them the meets held at this time of year may be entered by any shepherd from the parish of the meet or any adjoining,"sheep shown in show red colour and those with natural colour sheep with the best mouth but there is only one breed – herdwickherdwick sheep are not only part of the landscape here – there are cultural events centred around them the meets the sheep festival at the newcastle herdwick is a celebration of the breed, with sheep",0
ly uneven stimulating and underwhelming in equal measure ghostface killah and jayz turned in strong work and west himself sounds imperious throughout but all the bigname patronage in the world isn’t going to turn lesser names such as cyhi the prynce into premierleague talent 9 late orchestration 2,ly uneven stimulating and underwhelming in equal measure ghostface killah and jayz turned in strong work and west himself sounds imperious throughout but all the bigname patronage in the world isn’t going to make this album the best of the year. 2016-,0
to destabilise may’s leadership in the way johnson has but could make punchy interventions on the eu and immigration that place her firmly on the liberal modernising wing of the party philip hammond the chancellor has clashed with johnson in recent weeks over the need to make sure that the economy and business,to destabilise may’s leadership in the way johnson has but could make punchy interventions on the eu and immigration that place her firmly on the liberal modernising wing of the party philip hammond the chancellor of the exchequer has been the most prominent figure in the government to,1
americans and prompted the us to enter the second world war standing next to us president barack obama he solemnly vowed that japan “must never repeat the horrors of war again” on a historic warm december day that will likely be their last official meeting both men spoke of the power of reconciliation and the strength of the usjapanese,americans and prompted the us to enter the second world war standing next to us president barack obama he solemnly vowed that japan “must never repeat the horrors of war again” on a historic warm december day that will likely be remembered as the moment when the world’s most powerful country apologised for the atroc,0
in front of the atlantic ocean exhibit incredibly nothing but the sharks stirred until 7am the following day exit through the gift shop opens early for those who want to snap up a cuddly lemon shark before they leave and by putting your hand in your pocket you will help the aquarium a selffunded charity and one,in front of the atlantic ocean exhibit incredibly nothing but the sharks stirred until 7am the following day exit through the gift shop opens early for those who want to snap up a cuddly lemon shark before it’s time to leave. it’s the only shark that won’t snap at,0
and adolescent victims of sexual violence during the judicial processthere were several marches in bolivia last year to try to force government action on sexual violence and femicide as well as to protest against the allegedly corrupt justice system that allows it to continue“this has been a very long journey for brisa and it has been an honour to,and adolescent victims of sexual violence during the judicial processthere were several marches in bolivia last year to try to force government action on sexual violence and femicide as well as to protest against the allegedly corrupt judicial process. but the marches did not lead to any changes. there is now a new march planned,0
children protest to put themselves out for guests nobody even wantsyet an old world of social obligation turns out to have its point and the family’s chaotic grieving composes itself eventually around an ancient necessity to conform to keep up appearances – there is something to be said for itthe story is not an exact fit for georgie’s life but her son,"children protest to put themselves out for guests nobody even wantsyet an old world of social obligation turns out to have its point and the family’s chaotic grieving composes itself eventually around an ancient necessity to conform to keep up appearances – the family that doesn’t grieve, or doesn’t grieve well, is in danger",1
concert halls and theatres and other indoor venues such as hotels and community halls with entrance by ticket only plans to reopen conferences and exhibitions were delayed and will be reviewed in august about 83 of northern ireland’s adult population has received the first dose of a vaccine while 71 are fully vacc,"concert halls and theatres and other indoor venues such as hotels and community halls with entrance by ticket only plans to reopen conferences and exhibitions were delayed and will be reviewed in august about 83 of northern ireland’s 1,400 venues are expected to re",1
long life at sea they live for decades and don’t breed until they are about eight years old their single chick looks like a fluffy beanbag especially when their parents sit on it and while the bill of an adult has a teasing curve to it the chicks just look grumpy especially this one marooned alone in a vertical ocean of,"long life at sea they live for decades and don’t breed until they are about eight years old their single chick looks like a fluffy beanbag especially when their parents sit on it and while the bill of an adult has a black tip, the chick’s is yellowish-brown. this is a ju",1
in seasons has to offer less annoying than having to find your cagoule however the human body being somewhat more complicated than a basic bookkeeping system all your appetite hears is the activation it’s like the hulk it doesn’t want to do just one job it’s a force of nature not a supplier of goods and services it,in seasons has to offer less annoying than having to find your cagoule however the human body being somewhat more complicated than a basic bookkeeping system all your appetite hears is the activation it’s like the hulk it’s a force of nature and it’s not the hulk’s fault. it’,1
of people especially the young who are thinking ahead to what their world could look like greta thunberg kickstarted a global movement of school strikers demanding that governments “listen to the science” and “act as if the house is on fire” although some countries have ramped up their own emissions cuts targets – the uk now officially aims,"of people especially the young who are thinking ahead to what their world could look like greta thunberg kickstarted a global movement of school strikers demanding that governments “listen to the science” and “act as if the house is on fire”. in her speech to the un assembly on 12 september, she said:",0
